"start","end","text"
"0","8060"," So this is the third workshop in the non-visual data science workshop series, welcome all."
"9340","17340"," This one is, you know, it has kind of almost like two names, but I've kind of just updated it to a"
"17340","25860"," slightly more descriptive name, which is exploring and representing data, but originally I called it,"
"25900","29200"," which is a more exciting title, talking to your data, which I think is still irrelevant."
"29980","37420"," I'm able to hear, and in this workshop we will be exploring ways to represent different types"
"37420","42840"," of data, such as, we'll get to it in a minute, but categorical data, different kinds of data,"
"43560","51920"," time data, accounts data, and binary data, all different kinds of data, and we'll be thinking"
"51920","57520"," about different ways to represent those non-visually, you know, traditionally our"
"58140","63660"," most, you know, in data science in general, often people will resort to visualizations"
"63660","67920"," to represent these kinds of data. We'll be trying to, we'll be doing it non-visually, and we'll also"
"67920","76700"," be talking a little bit about how to replace visual, specific visualizations. So we'll kind of"
"76700","81860"," be trying to stay primarily in this non-visual realm, but I will speak sometimes to the practical"
"81860","86020"," elements of like, well, what if my colleagues ask for a bar chart, what if my colleagues ask for a"
"86020","93220"," line chart, something like that. I want to get a few administrative items out of the way. This is"
"93220","98740"," the midpoint in the workshop series. This is the third workshop. This is the last workshop that"
"98740","107600"," will be taught by me, and my colleague Sarah Kane, who's a Marshall Fellow at Cambridge in astronomy,"
"107780","115440"," will be taking over for the next two sessions to show you all sonification, which I'm very"
"115440","120120"," excited about. So we'll be switching gears a little, but we'll still be drawing on a lot of what"
"120120","125560"," we've learned in these first three workshops, and using, you know, IPython and some of these"
"125560","132720"," other tools that we have kind of been using all along. Okay, let me go through there. Since it's"
"132720","136900"," kind of the midpoint, I want to go a little more in depth in some of the administrative"
"137660","140780"," stuff. There's been some questions that have come up a couple of times from people,"
"144390","150130"," so I have a list here. Okay, yeah, so first of all, I'd like to thank those of you,"
"150690","153730"," or those, you know, you've kind of maybe come to know them a little bit, the helpers"
"153730","159530"," who are hanging out in the chat answering questions. So I just want to thank again"
"160930","171090"," Alex, Elizabeth, Sarah, Stephen, and also Paul and Monica, who I think Steve,"
"171090","176670"," Paul, and Monica aren't here today, but, you know, they really help things run smoothly and"
"176670","181930"," keep things humming along in the chat while people have questions. So thank you so much to the helpers."
"184010","187710"," I'd also like to thank, there's been some participants who have been sort of very"
"187710","196090"," actively contributing, and I'd like to thank Nikhil Vohra, who made some pretty extensive"
"196090","203110"," contributions to the first of the workshop series, the first curriculum for the workshop series,"
"203650","211070"," and he did that using GitHub, so he contributed using GitHub. He, you know, GitHub is basically,"
"211210","217410"," you can think of it as a social media site for programmers, but where people store their"
"217410","223770"," source code, download source code. It's sort of social media meets infrastructure, and he used"
"223770","229290"," features on GitHub to collaborate and contributed to the workshops, and that's something you can do."
"229410","234090"," You can just sort of do open source contributions to the curriculum that is currently hosted on"
"234090","241290"," GitHub if that interests you. You can also send ideas or updates or anything like that by email. "
"241710","246510"," I will say that, you know, if you're interested in entering this field, it can be really useful"
"246510","252230"," to have a bit of a history of contributions on GitHub, and so this is one way to kind of get"
"252230","256950"," started with that, so you can either create an issue, which is basically like you telling me"
"257930","262730"," that there's something that could be changed, and then I'll change it, or you can even do what's"
"262730","266370"," called a pull request, which is a little bit more complicated, but basically where you write up your"
"266370","271430"," own suggestions for how things should be changed, and I can accept it, pull it in, and then once,"
"271550","275970"," if you do that, you'll actually be a contributor on the curriculum, just like Nikhil is now, so"
"275970","279930"," that's something, an option for you. If you're interested in that, you can drop me a line at"
"279930","285250"," Patrick at IotaSchool.com, just if you wanted a little information on how to get started with"
"285250","290650"," those kinds of contributions, or just have an interesting view. Okay, and then we also had"
"290650","297830"," another contributor, Peter Zigmund, who is following along asynchronously, so probably"
"297830","305730"," not in the room, and Peter has been translating the curriculum to Hungarian, which is really"
"305730","310790"," exciting, and I'm excited to post that when he's completed it, so that's a very cool contribution"
"310790","316330"," as well, and I'd also just like, I think, to thank Chancey here, because I think, Chancey, you've"
"316330","322750"," helped me out with some of the ins and outs of using Zoom, and you just pointed out that I have"
"322750","328850"," a broken link on the curriculum and everything, so I really do appreciate everyone who's"
"328850","336810"," contributed so far. Let's see, one thing people have asked us about a lot is a mailing list"
"336810","342930"," for VI data scientists and people looking to get into data science or learning it,"
"343490","348790"," and I think that's a great idea. We have some, a lot of people signed up for this workshop series,"
"348850","355870"," and I think it's the basis of a good mailing list, you know, so I am looking into setting up a, or"
"355870","360830"," self-hosting a mailing list. If that doesn't go well, I guess I'll use free lists or something, but"
"361710","366050"," that, you know, it's a little bit technically involved, but I'm hoping to set it up this week,"
"367170","371670"," so since a bunch of people have asked for that, I do think it's a good idea, and I think we're"
"371670","378390"," going to go ahead and set that up, so excited for that, and I will send an email to the, to everyone"
"378390","383470"," who registered for this workshop when that is live, and also post on some of the main mailing"
"383470","390910"," lists, like Python Viz and so on. Something else people have asked about is, I think there are"
"390910","395790"," some frustrations with GitHub, I think maybe rightfully so, and some people would find"
"395790","401370"," the raw Markdown files that the curriculum is based on to be more useful. Some people would"
"401370","405350"," also kind of prefer to download the videos directly onto their computers, which I totally get,"
"407470","412990"," so we're going to try to facilitate that all by making, we're going to basically make sure the"
"412990","420050"," home that is a little more user-friendly, we're going to do that toward the end of this workshop"
"420050","424470"," series, or right after the series concludes, and we also, I also want to talk with the folks at"
"424470","429650"," Pandas to see if they want to host the curriculum, or if we should create a new website for it, but"
"429650","433690"," basically there will be a website for it, and there will be, you know, it will make it very"
"433690","437870"," easy for you to download the whole curriculum all at once if you prefer to have it on your computer,"
"437870","443850"," and also the videos to download directly, okay? So, that's not going to be right away, but it'll"
"443850","451080"," be probably shortly after this workshop series concludes in early March. Creating other tutorials,"
"451380","456520"," this is something I wanted to mention. We have a lot of stakeholders, you know, stakeholders is a"
"456520","463340"," stupid word, but people who are very involved in various blind and visually impaired organizations"
"464060","468800"," registered for this, and people who are parts of other major organizations, whether it be"
"468800","475500"," academia, science, the, you know, the blindness community. I'd just like to say, you know, I think this has"
"475500","481480"," been a great partnership, and that NumFocus has allowed us to create this very cool curriculum,"
"481900","487200"," make it open to the public. I just want, you know, I haven't pestered you guys that much about"
"487200","494940"," my own organization, IOTA, but I will say I would love the chance to create more resources like"
"494940","498800"," this for the blind community, to teach the blind community some more of these technical"
"499680","507180"," skills, and to create new curriculum, you know, workshop series like this, recordings. "
"508000","513419"," If you're part of an organization where you think they might be interested in collaborating to"
"513419","520940"," create these kinds of materials, reach out. It can be a, you know, I like, you know, in the best"
"520940","525520"," case scenario, it would be for the public. That's kind of where I like to be, but also, you know,"
"525820","531560"," I do work with organizations to create trainings specifically for your organization or resources"
"531560","537480"," specifically for your organization, too. So, you know, drop me a line if you think your organization would"
"537480","543860"," be interested in working with IOTA, and I'll just say, like, two sentences about IOTA. So, IOTA is"
"544580","550860"," consultancy. I'm the head of principal consultant, and we do various things, including creating"
"550860","557300"," curriculum like this, teaching workshops, but also we consult on what I would say some"
"557300","562340"," tricky intersections between accessibility, writing, you know, like creating a curriculum,"
"563600","567980"," and technology, so programming, okay? So, anything that kind of fits into those things, making web"
"567980","572740"," applications that have some connection to those things, stuff like that. That's where we kind of"
"572740","579240"," live. So, reach out, and if you have any projects in mind, okay? And that's probably the only"
"580860","585440"," that's probably the only I mean, one more little plug at the end of this whole workshop series,"
"585620","592960"," but please, you know, let other people know about this IOTA or the kind of work we do,"
"593140","597620"," if it comes up in conversation, because that's very helpful. It allows us to create things like"
"597620","605500"," this. That's just it. That's everything. Okay. And then I would just finally like to thank"
"606720","614240"," Pandas, Numfocus, and Patrick Hoefler, core developer at Pandas or with Pandas,"
"614700","620340"," to, you know, for taking a chance on this workshop series and creating these materials,"
"622100","626760"," and they're really the reason that, you know, this is all that possible. So, all right. So,"
"626760","632040"," that's more administrative stuff than usual, but we'll, you know, it's the midpoint of this"
"632040","641920"," workshop series. Okay. Let's go ahead and get started with the workshops. We are first I'm"
"641920","648220"," going to share my screen, and then we'll open up our IPython environment, and we will do a little"
"648220","655900"," discussion about different kinds of data. Okay? So, I'm going to go ahead and share."
"671980","680740"," Okay. I'm opening Anaconda prompt. I'm pressing the Windows button. I'm going to type Anaconda"
"680740","689820"," prompt. I typed A and A, and that was a note, but you may need to type a little more in your case. "
"689820","697680"," Remember, you want Anaconda prompt, not Anaconda navigator. And then, when you open Anaconda prompt,"
"697800","702580"," you have your command line. In Windows, we call this command line environment CMD. "
"703700","707780"," There's also another one that some of you have been using called PowerShell, which will more or"
"707780","712660"," less work with this, but I find that the CMD environment is a little more stable for applications"
"712660","720400"," like IPython, and I'm going to maximize the screen. I'm also going to remove the title bar"
"720400","732180"," by pressing alt enter. Okay? So, now I have a nice just the command line. And then,"
"732980","752260"," um, we need to start IPython. So, let's type IPython. That didn't update. So, that probably"
"752260","761660"," means my review is off. So, let's double check that. Okay. So, it didn't it didn't say the usual"
"761660","767020"," version. Let's just do it again. I quit IPython. I'm typing the word exit to quit."
"768160","772120"," And I'm running IPython again. So, you can hear how it sounds when you start it. "
"775920","778980"," So, you'll hear and there's a whole bunch of other information, but you'll hear the version."
"779340","782060"," Just a little review and sort of make sure you're all in the right environment."
"782060","793000"," Um, so, what are we doing today? So, a big part of data science is taking data in certain"
"793800","802200"," that takes certain forms and then representing it in various ways. Okay? And we'll talk about"
"802200","809700"," the different forms and so on in a second. But I, you know, so, what are the ways you can present"
"809700","816360"," data? So, we'll talk if you follow another data science tutorial, chances are the main way that"
"816360","821680"," they will represent data is through a visualization. And I looked up visual definition of"
"821680","827200"," visualization on Wikipedia, and it was the most general sort of definition of all time. It was"
"827200","832340"," basically like everything in the way they define everything as a visualization, like every picture,"
"832520","837500"," everything is a visualization. But basically, my definition is a visualization would be a it's a"
"837500","843640"," way to represent some kind of data visually. Okay? And the most common visualizations are"
"843640","849280"," things like charts and graphs, though there are other kinds of more complicated visualizations. "
"850580","855960"," And we'll get into some of the, but, you know, the most common charts and graphs would be things"
"855960","862460"," like bar charts, pie charts, line graphs, and scatter plots. Okay? There's a whole bunch of"
"862460","870540"," other kinds. I would say maybe 15 to 25 common visualization types, and then a more, a bunch more"
"870540","874540"," esoteric ones. But, you know, those are the ones you're going to encounter most frequently in the"
"874540","880380"," wild. And that's kind of the ones that people reach for most quickly. Okay? Now, what other"
"880380","887020"," ways are there to represent data? Since, you know, you and I and many people on this call don't,"
"887560","891800"," don't, you know, maybe we use visualizations, but we don't really benefit from them in the same way"
"891800","896840"," that sighted people do. Maybe we have to use them to share with our colleagues or something like"
"896840","903040"," that, but we don't benefit the same way. You can use a sonification. So, we're going to talk about"
"903040","912140"," that next week with Sarah's workshop on an introduction to sonification. Basically, it's a"
"912140","918900"," way to represent data through changes in sound, in qualities of sound. So, a quality of sound would"
"918900","923740"," be something like the pitch. Sarah might have her own definition, but that's my probably not as good"
"923740","932340"," definition. Other ways to represent data might be text descriptions. So, I mean, we sometimes say"
"932340","936980"," alt text in certain contexts, but I would also, the more general term would be a text description."
"937240","942760"," So, maybe the data is in some ways described in natural language, you know? So, if I say to you,"
"942760","949160"," oh, the data is two columns, and it's times, one column is times, one column is"
"950260","956340"," integers, and the integers are between five and 100, and they represent people's grades. You know,"
"956400","960280"," like that's, you know, that's a way to represent data, right? I'm telling you what the data is,"
"960560","964860"," gives you a general idea of the data. Maybe it's not quite as specific, but, you know."
"966840","972480"," Then there are other ways to represent data, but those are, I would say, are some of the big ones. "
"972480","977900"," The other one that I really want to mention is tactile graphics, which is a really cool direct"
"977900","988400"," way to experience forms similar to visualizations, but they're really, you access them through"
"988960","996020"," raised surfaces or other kinds of tactile interfaces, such as, you know, dots raised"
"996020","1002060"," in a digital, you know, some kind of refreshable braille display, and basically it lets you use"
"1002060","1008180"," your hands or, if you don't have hands, another one of your, another part of your body to"
"1008180","1013320"," experience the data manually or through tactician, you know, through feeling."
"1014540","1017500"," You know, so, you know, for example, you might feel a line chart. I know,"
"1018440","1021660"," I'm chanting not to call you out again, but I know you did a bunch of work with tactile"
"1021660","1025579"," graphics early in the pandemic, and once people are flattening the curve, so,"
"1026400","1032160"," the, you know, and when you have that available to you, you can feel things like a line chart,"
"1032660","1037380"," which is pretty cool, and a very direct way to experience something like people usually use with"
"1037380","1042180"," the visualization. Now, today we're going to do something completely different, really,"
"1042660","1048820"," and this is, there's not really a word for this. I call it talking to your data, okay, and I would"
"1048820","1053860"," also say it's an interactive data representation is another, maybe, that would be a more fancy way"
"1053860","1059400"," to say it. I kind of like talking to your data, okay, or a data conversation, and basically what"
"1059400","1067640"," that is is we load our data into a manipulatable structure, you know, like our data frame in"
"1067640","1075860"," Pandas, like a series in Pandas, and then we use programming to query the data, poke the data,"
"1076040","1081300"," transform the data, explore the data, and represent the data, do all sorts of things with the data,"
"1081300","1086500"," and clean the data is also another thing that you can do, and do all sorts of stuff with the data,"
"1086920","1090940"," and it has, there is pluses and minuses. We'll talk at the end about some of the advantages and"
"1090940","1097420"," disadvantages of this approach. I think, in many ways, it's a very exciting approach, and we're"
"1097420","1103000"," going to jump in with that now. So, what are we going to be representing in this workshop? So,"
"1103080","1107960"," let's just really quickly talk about types of data that we'll be working with, okay, and these are not"
"1107960","1113360"," formal types. Remember, in the first workshop, we talked about Python data types, so those were like"
"1113360","1121380"," things like a string, a list, an integer, which is a number, a float, which is a number, things like"
"1121380","1126540"," that, okay. Those are formalized because there's only a certain number of them. They exist in"
"1126540","1131460"," Python. They have certain formal ways that you interact with them, okay, through programming."
"1131840","1135940"," These categories I'm going to explain to you now, that I'm going to say types of data, which sounds"
"1135940","1140820"," a lot like data types. I'm talking about something different. I'm talking about very general ideas,"
"1141260","1147380"," okay. So, things like saying, if I say time data, that's, there's nothing formalized about that. It"
"1147380","1155500"," can take a lot of different forms. It could be anything from a string telling you January 6,"
"1155660","1163160"," 1995, with a comma and everything in it, to a number, which is the number of seconds since 1970,"
"1163160","1168620"," which is, surprisingly, that is actually something programmers do. They'll represent time as a number"
"1168620","1175460"," of seconds since a very specific moment in 1970, and that moment is called the epoch,"
"1176100","1180920"," which is pretty wild. Basically, it's almost like computer history started in a particular second"
"1180920","1185780"," in 1978. It can't from that point. It's one way to represent time. So, that could be an integer,"
"1186360","1190040"," and the other one could be a string, and other ones could be, there's other ways to represent it,"
"1190040","1195680"," more specific data types that are specifically for date and time. However, when we say time data,"
"1196020","1199880"," we mean data that represent points in time. So, it's a more general concept, okay."
"1200680","1207020"," What are the ones we're going to work with today? The main ones are numeric, which you've already"
"1207020","1213500"," worked with before in this workshop series. So, for example, our prices of the Airbnb listings"
"1213500","1221540"," from last time were numeric data. What else is there? There's the other really big one"
"1221540","1228480"," that you'll hear a lot about, and this is as close to a formalized one as you'll get,"
"1228660","1237340"," is categorical data, okay. Categorical data represents a sorting into various categories,"
"1237480","1242940"," or kind of like buckets. It will sort each entity in a data set into one of a small set"
"1242940","1248720"," of categories, okay. And we will talk, we will make that a little less abstract in a minute when"
"1248720","1254440"," we work with it, okay. There is also time data. I just discussed that as representation of points"
"1254440","1262340"," in time. And one other useful one to keep an eye out for is descriptive, or if you want to use a"
"1262340","1267720"," fancy word, nominative data. Basically, that's data that is a little more like a unique value. "
"1267720","1274420"," So, something like someone's email address in a data set, or Airbnb listings that we have,"
"1274540","1279900"," or an ID number, something like that. Those things, they tend to be unique, or a little"
"1279900","1287820"," closer to being unique, and they're usually used to identify things, okay. And for it, it doesn't"
"1287820","1292000"," usually make sense to order it, and it doesn't usually make sense to do things like get a mean"
"1292000","1296280"," or a median. Like, if you get a mean or a median of ID numbers, that is literally, it's mean,"
"1296280","1303140"," right, okay. So, basically, it's just descriptive of an entity, but not useful in the same way,"
"1303200","1310600"," like number, numeric data, or time data, or something like this, okay. Then I will throw"
"1310600","1316080"," in two other ones, and these are a little bit different because you will most often use these"
"1316080","1321900"," as an intermediate step when you work with data. And these, but you will sometimes find them in a"
"1321900","1327280"," data set directly, and those are, the ones we're going to talk about today are count,"
"1327460","1336020"," so when you count things up, and then also binary data, so whether something, whether a thing about"
"1336020","1340640"," the entities is true or false. So, for example, if we were to say in our Airbnb data set,"
"1342640","1347520"," it is underscore Brooklyn. We could make a new column called is Brooklyn, and that would be to"
"1347520","1352740"," either say true if the listing was in Brooklyn, and false if it was anywhere else, okay. That"
"1352740","1358160"," would be binary data, all right. And we'll work with most of these. We might not do so much with"
"1358160","1361920"," descriptive or nominative data in this workshop, but I wanted you to keep an eye out for it. "
"1362980","1367040"," But we will work with the other ones pretty directly in this workshop. Hopefully,"
"1367120","1373020"," we can get to most of this. There's definitely a lot. All right. So,"
"1376720","1381620"," let's jump right in and say, let's work with categorical data a little bit, because this is one"
"1382520","1387300"," that I would say it's probably the most, one of the most important to wrap your head around"
"1387300","1391540"," outside of straight numeric data, which we worked with last week and doing things like the mean and"
"1391540","1396180"," the median. And so, knowing how to work with categorical data, categorical data is really"
"1396180","1403360"," critical for data science. And even, especially when you're like starting an analysis or something"
"1403360","1409100"," like that. So, you may be like, okay, I didn't really get your explanation of categorical data."
"1409460","1416100"," Let's actually pull some categorical data from our data set, and then we will talk about what"
"1416100","1419980"," categorical data it is. Again, when we actually have an example in front of us, so it won't be as"
