"start","end","text"
"1419980","1423540"," confusing and abstract. We'll actually have an example in front of us, okay."
"1424240","1431980"," So, the first thing we'll do is we will pull in our data set. And it's going to be the same as last"
"1431980","1437220"," week. So, I'll tell you exactly what to type. I will give you instructions for people who participated"
"1437220","1443300"," last week. I'll give you a little bit of a shortcut, okay. So, you can type, you may be able to do this."
"1444880","1453560"," df = pandasAnd then you can type a little bit of pandas,"
"1453780","1461340"," P-A-N. ""P-A-N."" And you can, if you press the up arrow, it may fill in our URL and everything"
"1461340","1465000"," that we had before. So, we fill in a bit of what you wrote before, and then you can press the up"
"1465000","1488220"," arrow. So, it did fill it all. I'll go through that. Don't worry if you didn't catch that."
"1488600","1494420"," I'm going to press enter. Sorry, I skipped a step. You need to first"
"1494420","1507280"," import pandas. So,""I-M-P-O-R-T. Space. P-A-N-D-A-S."""
"1507620","1524400"," P-A-N-D-A-S. Okay. And then we'll run our DF equals. And I will go through it again. So,"
"1524400","1531460"," in left. Okay. It worked for me. So, what you want to type, if you don't have it stored in"
"1531460","1537580"," your history, I tried to tell you a way to access this line from your history from last week. If"
"1537580","1541060"," you don't have it in your history, maybe you're doing this for the first time. Maybe you can't"
"1541060","1552880"," detect it for some reason. Go ahead and type this. DF space. That's D as in dog, F as in foxtrot."
"1554400","1570820"," And then space equals space pandas, P-A-N-D-A-S, dot read underscore CSV. Open parenthesis. "
"1571520","1579120"," And now you want to pin in a URL as a string. So, we do a double quote. Then do HTTP"
"1579120","1594080"," colon forward slash forward slash bit.ly, B-I-T, period, L-Y, forward slash NYC"
"1596140","1602540"," BNB. So, that's Bravo November Bravo, you know?"
"1604400","1612920"," New NYC for New York City. And then BNB. Bravo November Bravo. B as in boy, N as in Nancy."
"1614100","1619580"," And then finish the double quotes, do a right parenthesis, and then run it."
"1620660","1625400"," Hopefully, helpers, maybe you can also paste it in so people have the option to copy it. "
"1625760","1629060"," And it's also present in the written curriculum that we're going to follow along."
"1629060","1635800"," Okay. Once you have it loaded in, you should be able to do DF. Just type DF by itself,"
"1635980","1650080"," and you have your data. That's enough. It's staying the number of rows, and there's a"
"1650080","1654340"," whole lot of information. It's probably read for like 20 minutes if we, there's a ton of"
"1654340","1660560"," information. But basically, it's our big data set. We could do, you know, you could do things"
"1660560","1667120"," like on it like we did last week. We can do len on it to see how many rows. DF.shape to see how"
"1667120","1673180"," many columns and rows. You could do all the things that we did before. DF.columns to see the columns."
"1674140","1680060"," These are things we all did in the last workshop. You could do them, this is the same data as we"
"1680060","1689840"," used last week in this data frame object. Okay. Now we have our data in front of us."
"1690520","1696200"," Let's pull out some categorical data and think about it. Okay. And explore it. So, I'm going to"
"1696200","1702560"," clear my screen because it helps me out cognitively to clear my screen before I do something new. "
"1704020","1711920"," So, I did control L, and I heard, you know, in left bracket, five, right bracket. We're entering"
"1711920","1731380"," the fifth line that we've entered so far. Let's do ""DF.neig."" And I'm going to let it fill it in"
"1731380","1739460"," by pressing tab.So, go ahead and press tab. Neighbourhood. Because it was filling in the"
"1739460","1744700"," rest of the word neighborhood. I say to do this because for some reason this data set, it spells,"
"1745440","1751400"," which is fine, but some of us are Americans, we don't use the U in neighborhood. Okay."
"1752660","1760420"," So, in British English, they say a neighborhood with a U. In American English, we don't do the U."
"1760420","1764680"," So, this is a point of confusion. But in this data set, it's spelled the British way. Okay."
"1765360","1770680"," So, I recommend using the tab and just letting the computer fill it in. There will be no confusion,"
"1770800","1777060"," no problems. Okay. I recommend to do that whenever you can.Okay. So, we want to do DF.neighbourhood,"
"1777580","1784820"," and then I'm going to do a period. So, remember, it's neighborhood with U, dot, dot, head,"
"1784820","1793400"," ""in left bracket, H, E, A, D, head, left paren, right paren.""So, I did head, left parenthesis,"
"1793540","1799520"," right parenthesis. So, it's got DF.neighborhood.head. Okay. And we should get the first five items from"
"1799520","1804480"," this column. Okay. The neighborhood column in our Airbnb data set. All right. We're getting"
"1804480","1811920"," ""the first five items. Out left bracket, five, right bracket, colon, zero, Kensington, one,"
"1811920","1822680"," Midtown."" Oh, I'm sorry.I meant to do a... This is fine, actually. So, this is our data for"
"1823540","1827040"," individual neighborhoods. What I actually wanted to use is neighborhood group,"
"1827400","1832920"," which will tell us something a little more specific about this categorical data. So,"
"1832980","1836760"," if you want, you can type it again. That's probably the easiest way. You can also press"
"1836760","1847700"," up and backspace your answer.I'll type it again. So, I'll do DF.neighbourhood. I'm letting it fill"
"1847700","1855360"," it in. And then I'm just going to go to underscore and tap in and then fill in group. So, it's"
"1855360","1861500"," neighbourhood underscore group. DF.neighbourhood underscore group. That's what we want.And"
"1861500","1866080"," essentially, you'll see in a second what this corresponds to if you're familiar with New York"
"1866080","1871900"," City, the different boroughs in New York City. So, Manhattan, Queens, Staten Island, the Bronx,"
"1872680","1878800"," and Brooklyn. Okay? So, let's... And that's our column. Let's do head so we only get the first"
"1878800","1890900"," five. So, it should be DF.neighborhood underscore group dot... Open parenthesis. Okay. So,"
"1890900","1895720"," open parenthesis, close parenthesis. DF.neighborhood underscore group dot head open parenthesis,"
"1895880","1915320"," close parenthesis. You'll notice something. And this is what I wanted to show you. And this is"
"1915320","1921760"," why the neighborhood wouldn't really help us with this. This is the main characteristic"
"1921760","1927960"," of categorical data is that the values are repeated. Okay? So, this column consists of a"
"1927960","1934080"," relatively small set of values. So, Manhattan, the Bronx, Queens, Brooklyn, and Staten Island."
"1934340","1940780"," And they're repeated over and over again. And when they appear in this column, they tell us that"
"1940780","1947560"," the item in the row, the entity, which in our case, it represents an Airbnb listing from 2019."
"1948100","1953500"," Okay? Each row in this data set is an Airbnb listing from 2019. And when one of these items"
"1953500","1958540"," appears in this column, it tells us, hey, that listing is from the Bronx. It's from Queens. It's"
"1958540","1963460"," from Manhattan. Okay? And you'll notice the two here that are appearing most frequently are"
"1963460","1969920"," Manhattan and Brooklyn. Okay? We can confirm that in a minute. But when you see repeated data like"
"1969920","1976660"," this, when you see repeated information, and it could be numbers too, but if it's a small number"
"1976660","1981760"," of items that are repeated, then that gives you an indication that it's categorical data. Okay?"
"1981840","1985700"," Also, if you think about, hey, this could basically be considered a category. So,"
"1985740","1988600"," something like neighborhood group, that sounds like a category. And neighborhood sounds like"
"1988600","1995440"," a category. Okay? Then it's going to be categorical data. It sorts the data, the entities in the data"
"1995440","2002080"," set into various little buckets. Okay? Now, what do you do with categorical data? How do we"
"2002080","2007640"," represent it? How do we explore it? So, the first thing you should do with categorical data typically"
"2009820","2017620"," is to get a set. Okay? So, there's two things you should do right away with categorical data. "
"2017820","2023800"," To get a set of all the categories and then to count the various items. Okay? These are the two"
"2023800","2032640"," things we're going to do in order. Okay? So, let's do the line we had before, but now we're going to"
"2033420","2040140"," put the we're going to put the function set around all of it. Okay? So, I'll type it again. Set."
"2040140","2052360"," ""Set.""Open parenthesis. And then df.neighborhood underscore group."
"2055940","2062920"," That's the line in underscore. Group. So, it's neighborhood group, underscore group,"
"2063880","2071560"," dot. And let's not do the head. It doesn't really matter here. So, we could do set df.neighborhood"
"2071560","2090900"," group. Set open parenthesis df.neighborhood group.Those are our five items. ""Bronx, Brooklyn,"
"2091880","2098020"," Staten Island, Manhattan, and Queens."" Okay? Those are the five items.Those are our categories. And"
"2098020","2103940"," we use the set function. It basically says give us the unique values from this data set. Okay?"
"2104380","2108660"," And what it returns here is a list-like object, which is a set object. But it's very similar to"
"2108660","2115760"," a list. Okay? So, that tells us how many categories we have to work with. The other thing that I"
"2115760","2120080"," recommend doing with a with categorical data, once you know that it is categorical data,"
"2120080","2126320"," even if you suspect it's categorical data, is to count it. And I would also say that set is very"
"2126320","2131580"," good at telling you, is this categorical data? So, if you run the set function on a column,"
"2132240","2138520"," then you will learn, you will see, oh, is it a small number of categories of repeated values?"
"2138760","2142620"," If it's a small number of items that come back, then that's a strong indication that"
"2142620","2147680"," where you're working with is categorical data. But if it's almost as many items as we have"
"2149420","2152700"," rows in the data set, then it's probably not categorical data. It's probably something"
"2152700","2158080"," like descriptive or nominative data. If you ran a set on email addresses, it will pretty much"
"2158080","2165340"," be the same number of items as the full data set. Okay? So, let's do let's now let's do a count. "
"2165540","2169240"," Okay? And we'll talk about counts. So, let's do df.neighborhood group again."
"2172220","2177880"," df.neighborhood group. Remember, I'm making a lot of use of tab here. This is where tab is"
"2177880","2180380"," going to come in useful. We're going to be writing longer lines in this session. "
"2181700","2187040"," So, we're going to be doing I'm going to use tab a lot more. Hopefully, you're getting a little"
"2187040","2191440"," bit used to this environment. I will also say, you know, if I'm moving sometimes a little bit"
"2191440","2196000"," fast in these workshops, you know, which is kind of the nature of some of these more online"
"2196000","2199260"," workshops. In-person workshops, they tend to go a lot slower, and there's time to work."
"2199980","2203400"," But, you know, we're kind of doing this for the recording a little bit. And you can review"
"2205960","2209020"," afterward. And there's a raised hand. We'll get to that in one second."
"2212080","2215020"," There's a recording, and there's a written curriculum. So, if you're feeling a little"
"2215020","2218160"," stress at any point in this workshop, just remember that those resources that they're"
"2218160","2223620"," available to you. And Sarah and I are available. We're just an email away. And there's also the"
"2223620","2227060"," office hours on Thursday. So, a lot of resources available to you if you're feeling a little"
"2227060","2233440"," learning stress. We had a raised hand. Is that an intentional raised hand? I mean,"
"2233680","2236920"," we can, if you want to get on the mic and ask a question, you're welcome."
"2242730","2248970"," I hit that button all the time myself, too. So, if you do, you know, if it was a question you"
"2248970","2255530"," wanted to ask, just feel free to get on the mic. Okay. So, DF.Neighborhood group. And now, so,"
"2255530","2260670"," we had to DF.Neighborhood underscore group.And now, we're going to use a new method. And we're going to use"
"2260670","2266130"," this method a lot. Okay. So, try to remember what it's called because we're going to be using it a"
"2266130","2271830"," lot. Okay. But you'll get a little reinforcement as this goes on. Let's do DF.Neighborhood group."
"2272630","2291690"," Value underscore counts. So, it's DF.Neighborhood underscore group. Value underscore counts."
"2291790","2300290"," Open parenthesis. Close parenthesis. I kind of hate the name of this method because it's hard"
"2300290","2304890"," to type. It has an underscore in it. It's kind of long. And I use it a lot. It's one of the methods"
"2304890","2310950"," I use the most when I'm doing a data analysis. Okay. So, and we're going to use it a lot, too."
"2311150","2315550"," So, remember that tab is your friends. In this case, it might not be that useful to you. But,"
"2315710","2321070"," you know. All right. Let's run it and see what we get. Out left bracket eight right bracket colon"
"2321950","2332330"," ""Manhattan 21,661. Brooklyn 20,104."" So, okay.What are we listening to here? We'll zoom in a second."
"2332890","2341290"," We're hearing a series which has labels. Remember from last week, what we have the series is"
"2341290","2349510"," represented with two columns. For us, screen reader users, it's that each line has on the left"
"2349510","2355190"," first a label. Okay. Which is the index. And on the right, it has a value. In this case,"
"2355230","2362730"," it's a number. Okay. So, we're listening to a series. The labels are the categories. Okay. So,"
"2362750","2369030"," Manhattan, Bronx, Brooklyn, et cetera that we got from our set. These are the unique values in this"
"2369030","2377430"," column. Okay. And then the right most column or the right most item in each line is the value."
"2377430","2381950"," Okay. Which in this case, because we're performing a count, we created a count,"
"2382390","2387730"," it's the count. It's how many times each of these items appears in the dataset. Okay. So,"
"2388230","2395350"," we heard Manhattan was something like 21,000 something something. Brooklyn was 20,000 something"
"2395350","2403710"," something. So, a little bit less. Let's listen to one more. So, Queens, there's a bit of a drop,"
"2403710","2415130"," 5,660 something. Bronx is another drop. Okay. So, you're hearing the values. It's pretty"
"2415130","2424790"," intuitive. It tells us how many items in our dataset. 20,000 some odd are Manhattan. 20,000"
"2424790","2434710"," some odd are Brooklyn. About 5,000 are the Queens and about something like 1,000 are Bronx. And a"
"2434710","2439290"," very small number presumably are Staten Island. I guess we could look into that. ""Staten Island"
"2439290","2446690"," 373.""Only 373. Very few Airbnbs on Staten Island. So, if you want to run an Airbnb,"
"2446690","2455150"," don't open it on Staten Island. Maybe open it on Manhattan. I'm not in that business."
"2455730","2460610"," Don't take my advice. And then at the end, it'll say the D type. Remember, series always tells"
"2460610","2469670"," you the D type. ""Name colon neighborhood line group.dtype colon int."" D type int. So, it's"
"2469670","2475070"," integers. The items in this are integers. Okay. They're counts. Now, okay. Let's talk about this"
"2475070","2482350"," a little bit. First of all, this is already very useful. You pretty much if you've ever been"
"2482350","2488970"," familiar with a bar chart, some of us are, you know, you have partial vision. Some of us used"
"2488970","2494550"," to be sighted or more sighted. Maybe you're familiar with visualizations. You know what a"
"2494550","2503050"," bar chart looks like. I'll just quickly describe it. A bar chart basically it represents data with"
"2503050","2508650"," how long different lines are. Okay. So, if a line is longer, it has more items in it. Okay. "
"2510990","2516170"," Basically, what we have here is basically it's a bar chart. Okay. It tells us how many items there"
"2516170","2522990"," are. And it's almost it's almost like if we were going to take a bar chart created by a sighted"
"2522990","2529270"," data scientist and represent it in some format that is accessible to the visually impaired,"
"2529270","2533810"," we might actually pick a format like this and it actually would be pretty good. You might have"
"2533810","2537010"," your own preferred format, but this one is actually not terrible. Okay. It's like it's"
"2537010","2542470"," pretty it has a label. It has a number. Each each pair is on a line. It's actually pretty usable."
"2542750","2550210"," Okay. So, basically what you have here is a bar chart. Okay. Now, how is it different from"
"2551550","2555490"," what what could a sighted person do a little more advantageously with a bar chart that you"
"2555490","2562210"," couldn't do with this? I would my answer to that is, first of all, not that much. But if I had to"
"2562210","2568730"," say one thing, it would be that the sighted person might get very intuitively to their mind the"
"2568730","2574090"," difference between the different items. Okay. So, instead of hearing the or seeing the very specific"
"2574090","2580630"," numbers, they might be like, oh, okay. They might get an insight like, for example, Brooklyn and"
"2580630","2585010"," Manhattan are really close together. There's a pretty big drop off between those two and Queens"
"2585010","2590330"," and then another big drop off between Queens and the Bronx. Okay. Now, to be honest, you can get"
"2590330","2596930"," that from these numbers pretty easily. Okay. But let's say let's make it even more like a bar chart"
"2597490","2604190"," and actually and also very similar to a pie chart because a pie chart represents data by"
"2604850","2610610"," it draws a circle. So, if you make a circle with your hand and then different slices on the circle"
"2610610","2619370"," represent their proportion of each item in the data set. Okay. So, we have about 20 percent of"
"2619370","2625970"," the items are Brooklyn. So, 20,000 divided by some 40 something thousand would be something"
"2625970","2631450"," like 40 something percent. Okay. Just to do some back of the napkin. So, we would take out a slice"
"2631450","2636630"," of the pie that would be 40 something percent. That is basically how a pie chart works. Data"
"2636630","2640630"," scientists actually hate pie charts and they look down on people who use pie charts, but in my"
"2640630","2649370"," experience people like many bosses and stuff that I've had like pie charts. So, but, you know, mostly"
"2649370","2652930"," things that you could do with a pie chart you could do with a bar chart and probably better. "
"2653810","2657490"," But so, basically what we're doing here is we're thinking of ways to replace both pie and bar"
"2657490","2662090"," charts. Okay. But what we're going to do now is even more like a pie chart and it also will give"
"2662090","2667590"," you a little more of that intuition of the differences in the sizes. Okay. So, let's use"
"2667590","2672650"," the second technique here. So, you already basically have replaced bar charts, I think. "
"2673070","2678230"," And bar charts are one of the easiest to replace non-visually in my opinion. But let's make it"
"2678230","2684450"," even better. Let's make our representation or non-visual representation even more like intuitive"
"2684450","2690730"," to us. Okay. Or even more useful. So, let's do this. First, let's save our counts to a variable."
"2690730","2697350"," Okay. And I'm going to tell you how to do that with some hot keys. Okay. If that's okay. So,"
"2697470","2703110"," if you prefer to type it all out, that's fine. We'll go over that as well. But let's press the"
"2703110","2712690"," up button. That loads in the last line we ran. So, that will be the one that where we get our"
"2712690","2719230"," counts. Okay. Now, press control A. And you won't hear anything. Just press control A to go to the"
"2719230","2728370"," beginning of the line. And then type let's just call it neighborhood counts. Okay. And you can"
"2728370","2732530"," spell neighbourhood any way you want. I'm going to spell it the British way, I guess, because that's"
"2732530","2748210"," closer to the answer. ""neighbourhood_counts = "" And then I'm going to do a space and equals and a space."
"2750970","2758130"," So, what I'm doing is I'm saving the last line to a variable. Now, you could also do a really"
"2758130","2761870"," quick way to do this is another cool way to do this is you could type neighborhood underscore"
"2761870","2767710"," counts equals underscore. Because underscore actually represents the last line you put in,"
"2767810","2773350"," which is pretty cool. And that's one of the contributions Nick Hilvora made when he edited"
"2773350","2779630"," the first in this workshop series is he added a description of that underscore that Python lets"
"2779630","2783390"," you do, which is a pretty cool trick. So, you could do that. Or you could do what I did, which"
"2783390","2787590"," is to press up, move to the beginning of the line with control A, and then type it in. Okay."
"2788070","2792350"," Because who wants to type everything over and over again? Certainly not programmers. Programmers"
"2792350","2798890"," are lazy. In left bracket ten right bracket colon. Okay. So, basically, what we did there is"
"2798890","2803410"," we saved our previous counts to a variable. So, we did neighborhood underscore counts equals"
"2805050","2811910"," df.neighborhood underscore group.value underscore counts. Okay. And we didn't want to type it all. "
"2818750","2822490"," If someone wants to get on the mic for the question, that's fine. I'm hearing raised hands."
"2822670","2825770"," But maybe actually just type in the chat if you want to raise your hand because it's"
"2825770","2830130"," in maybe accidental hand raising, which is something I very frequently do in meetings. "
"2830990","2834590"," Because I often want to look at the participant list and then I raise my hand by accident."
"2835450","2841150"," Okay. So, we now have neighborhood underscore counts. So, that's our counts that we were just"
"2841150","2848250"," looking at. The five items, each with the label of the borough, you know, Manhattan, Bronx,"
"2848510","2852130"," you know, the neighborhood group, and then the count, the number of times it occurs in the data"
"2852130","2856130"," set. So, that's what we have saved to the variable. What we're going to do now is"
"2856130","2873030"," neighborhood underscore counts. Did it do it? Space. In left bracket. Oh, it filled it all in."
"2873810","2879630"," Neighborhood underscore counts. So, I used the tab to fill it in. You can type it all out yourself"
"2879630","2883950"," too if you prefer. It's neighborhood underscore counts. That's the variable we created. And now,"
"2884230","2888390"," what we're going to do is it's a new technique. We're going to get the proportions of the data."
"2888670","2892510"," Okay. And they're going to be kind of like decimal points, kind of like fractions"
"2893350","2899750"," that are going to represent how much of the data is each item. Okay. So, we're going to do divided"
"2899750","2911410"," by.So, it's neighborhood underscore counts divided by. Len for length. ""L-E-N.Len. Left"
"2911410","2920590"," paren.D-F. Right paren."" Neighborhood underscore counts."
"2921910","2927530"," Then, a space. A forward slash. A space. Remember, forward slashes divide. And then,"
"2928130","2936690"," len. Open paren. D-F. Close paren. And so, basically, the len D-F tells us the total"
"2936690","2940710"," number of items in the data set. So, that's 40 something thousand. That's all the items,"
"2940830","2945550"," all the listings in this data set. And then, so, what this is going to do is going to divide each"
"2945550","2950830"," item in our counts by the total number in the data set. So, Manhattan is 21,000 something."
"2951510","2957730"," It's going to then divide that by 49,000 and something. Okay. And what that will give us"
"2957730","2964310"," is a decimal that will tell us the proportion of the items in the data set that are that. Okay. And"
"2964310","2970530"," remember, we said it would be something like 40 something. .44 or .43. It'll be something like"
"2970530","2975870"," that. Okay. And that will tell us that 44, 43 percent or whatever of the items are Manhattan. "
"2976470","2979190"," But anyway, let's run it and see what it sounds like. Okay."
"2979370","2984210"," ""Out left bracket 10 right bracket colon.Manhattan 0.44."""
"2984590","2989530"," So, you hear that. 0.44. Okay. So, that's about 44 percent of the items in this column are"
